{"advisory":{"advisory_id":"artifact-incident-1","artifact_plan_sha256":"32d57b7e32770f6ef3f1b339364065d0bc32debf1f83557b7334b764d3892a7c","issued_at":"2026-09-03T00:10:00Z","issued_at_ms":1000,"limitations":["vex_statuses_are_bounded_metadata_projections_not_openvex_csaf_or_cisa_document_validation","source_document_authentication_issuer_authority_and_vulnerability_truth_are_not_established","affected_and_under_investigation_are_fail_closed_actionable_states_for_this_benchmark","replacement_digests_and_provenance_are_declared_metadata_not_artifact_safety_evidence"],"lineage_sha256":"db6000f9c341888976b63b00ada541bf058d8a0d302a8d411f9fee84e9007f1e","replacements":[{"artifact_id":"alpha-model","provenance_statement_sha256":"3333333333333333333333333333333333333333333333333333333333333333","replacement_sha256":"8888888888888888888888888888888888888888888888888888888888888888","workload_principal_id":"workload-alpha"}],"schema":"https://github.com/immu4989/lurebench/spec/lureartifact-advisory-v1","schema_version":1,"source":{"authentication_boundary":"externally_verified_document_metadata","document_sha256":"1111111111111111111111111111111111111111111111111111111111111111","format":"openvex-0.2.0"},"statements":[{"component_id":"alpha-base-model","justification":null,"sha256":"9999999999999999999999999999999999999999999999999999999999999999","status":"under_investigation"}],"thresholds":{"quarantine_deadline_ms":500,"recovery_deadline_ms":2000},"vulnerability":{"description_sha256":"2222222222222222222222222222222222222222222222222222222222222222","identifier":"CVE-2026-4989"}},"advisory_sha256":"c0e61c8bac8a4f7180772026372d0c5746439af29ee948673d9fca5b8bdf2157","artifact_plan":{"created_at":"2026-09-03T00:05:00Z","identity":{"plan_id":"example-identity-offboarding-campaign","plan_sha256":"dbf36e323ebd25ceb44dd258aa0956efcb81cb3edb19950ccc1b48738c13d771"},"limitations":["plan_binds_every_active_declared_workload_to_reviewed_artifact_metadata_at_declared_nodes","spiffe_ids_are_identifiers_only_and_do_not_prove_svid_issuance_validation_or_possession","slsa_fields_are_a_bounded_projection_not_statement_signature_or_build-platform_verification","ai_bom_fields_are_a_bounded_projection_not_spdx_or_cyclonedx_document_validation","plan_validation_does_not_fetch_scan_load_import_execute_or_deserialize_artifact_bytes"],"nodes":[{"enforcement_point_id":"policy-gateway","node_id":"identity-policy-gateway"},{"enforcement_point_id":"credential-broker","node_id":"identity-credential-broker"}],"plan_id":"lureartifact-conformance","policy":{"allowed_model_serializations":["onnx","safetensors"],"approved_builder_ids":["https://github.com/actions/runner"],"model_embedded_code_allowed":false,"provenance_required_for_roles":["container_image","model_weights","policy_bundle"],"remote_model_code_allowed":false,"required_artifact_roles":["ai_sbom","container_image","model_weights","policy_bundle"],"sbom_subject_roles":["container_image","model_weights","policy_bundle"]},"schema":"https://github.com/immu4989/lurebench/spec/lureartifact-plan-v1","schema_version":1,"standards":{"provenance_predicate_type":"https://slsa.dev/provenance/v1","statement_type":"https://in-toto.io/Statement/v1","supported_ai_bom_formats":["cyclonedx-1.6","cyclonedx-1.7","spdx-3.0.1"]},"system_id":"example-agent-system","workloads":[{"ai_bom":{"artifact_id":"alpha-ai-bom","document_sha256":"dddddddddddddddddddddddddddddddddddddddddddddddddddddddddddddddd","format":"spdx-3.0.1","subject_artifact_ids":["alpha-container","alpha-model","alpha-policy"]},"artifacts":[{"artifact_id":"alpha-ai-bom","media_type":"application/spdx+json","model_embedded_code":false,"model_serialization":null,"package_url":null,"remote_code_required":false,"role":"ai_sbom","sha256":"dddddddddddddddddddddddddddddddddddddddddddddddddddddddddddddddd"},{"artifact_id":"alpha-container","media_type":"application/vnd.oci.image.manifest.v1+json","model_embedded_code":false,"model_serialization":null,"package_url":"pkg:oci/example/lureagent-alpha@sha256:aaaaaaaaaaaaaaaaaaaaaaaaaaaaaaaaaaaaaaaaaaaaaaaaaaaaaaaaaaaaaaaa","remote_code_required":false,"role":"container_image","sha256":"aaaaaaaaaaaaaaaaaaaaaaaaaaaaaaaaaaaaaaaaaaaaaaaaaaaaaaaaaaaaaaaa"},{"artifact_id":"alpha-model","media_type":"application/vnd.safetensors","model_embedded_code":false,"model_serialization":"safetensors","package_url":"pkg:huggingface/example/model-alpha@0123456789abcdef","remote_code_required":false,"role":"model_weights","sha256":"bbbbbbbbbbbbbbbbbbbbbbbbbbbbbbbbbbbbbbbbbbbbbbbbbbbbbbbbbbbbbbbb"},{"artifact_id":"alpha-policy","media_type":"application/vnd.openpolicyagent.bundle","model_embedded_code":false,"model_serialization":null,"package_url":"pkg:generic/example/alpha-policy@1.0.0","remote_code_required":false,"role":"policy_bundle","sha256":"cccccccccccccccccccccccccccccccccccccccccccccccccccccccccccccccc"}],"attestations":[{"attestation_id":"alpha-container-provenance","build_type":"https://github.com/actions/runner/build/v1","builder_id":"https://github.com/actions/runner","predicate_type":"https://slsa.dev/provenance/v1","source_sha256":"1111111111111111111111111111111111111111111111111111111111111111","statement_sha256":"eeeeeeeeeeeeeeeeeeeeeeeeeeeeeeeeeeeeeeeeeeeeeeeeeeeeeeeeeeeeeeee","statement_type":"https://in-toto.io/Statement/v1","subject_artifact_id":"alpha-container","subject_sha256":"aaaaaaaaaaaaaaaaaaaaaaaaaaaaaaaaaaaaaaaaaaaaaaaaaaaaaaaaaaaaaaaa"},{"attestation_id":"alpha-model-provenance","build_type":"https://github.com/actions/runner/build/v1","builder_id":"https://github.com/actions/runner","predicate_type":"https://slsa.dev/provenance/v1","source_sha256":"2222222222222222222222222222222222222222222222222222222222222222","statement_sha256":"ffffffffffffffffffffffffffffffffffffffffffffffffffffffffffffffff","statement_type":"https://in-toto.io/Statement/v1","subject_artifact_id":"alpha-model","subject_sha256":"bbbbbbbbbbbbbbbbbbbbbbbbbbbbbbbbbbbbbbbbbbbbbbbbbbbbbbbbbbbbbbbb"},{"attestation_id":"alpha-policy-provenance","build_type":"https://github.com/actions/runner/build/v1","builder_id":"https://github.com/actions/runner","predicate_type":"https://slsa.dev/provenance/v1","source_sha256":"3333333333333333333333333333333333333333333333333333333333333333","statement_sha256":"0000000000000000000000000000000000000000000000000000000000000000","statement_type":"https://in-toto.io/Statement/v1","subject_artifact_id":"alpha-policy","subject_sha256":"cccccccccccccccccccccccccccccccccccccccccccccccccccccccccccccccc"}],"node_ids":["identity-credential-broker","identity-policy-gateway"],"spiffe_id":"spiffe://example.com/agents/alpha","workload_principal_id":"workload-alpha"},{"ai_bom":{"artifact_id":"beta-ai-bom","document_sha256":"7777777777777777777777777777777777777777777777777777777777777777","format":"cyclonedx-1.7","subject_artifact_ids":["beta-container","beta-model","beta-policy"]},"artifacts":[{"artifact_id":"beta-ai-bom","media_type":"application/vnd.cyclonedx+json","model_embedded_code":false,"model_serialization":null,"package_url":null,"remote_code_required":false,"role":"ai_sbom","sha256":"7777777777777777777777777777777777777777777777777777777777777777"},{"artifact_id":"beta-container","media_type":"application/vnd.oci.image.manifest.v1+json","model_embedded_code":false,"model_serialization":null,"package_url":"pkg:oci/example/lureagent-beta@sha256:4444444444444444444444444444444444444444444444444444444444444444","remote_code_required":false,"role":"container_image","sha256":"4444444444444444444444444444444444444444444444444444444444444444"},{"artifact_id":"beta-model","media_type":"application/onnx","model_embedded_code":false,"model_serialization":"onnx","package_url":"pkg:huggingface/example/model-beta@fedcba9876543210","remote_code_required":false,"role":"model_weights","sha256":"5555555555555555555555555555555555555555555555555555555555555555"},{"artifact_id":"beta-policy","media_type":"application/vnd.openpolicyagent.bundle","model_embedded_code":false,"model_serialization":null,"package_url":"pkg:generic/example/beta-policy@1.0.0","remote_code_required":false,"role":"policy_bundle","sha256":"6666666666666666666666666666666666666666666666666666666666666666"}],"attestations":[{"attestation_id":"beta-container-provenance","build_type":"https://github.com/actions/runner/build/v1","builder_id":"https://github.com/actions/runner","predicate_type":"https://slsa.dev/provenance/v1","source_sha256":"bbbbbbbbbbbbbbbbbbbbbbbbbbbbbbbbbbbbbbbbbbbbbbbbbbbbbbbbbbbbbbbb","statement_sha256":"8888888888888888888888888888888888888888888888888888888888888888","statement_type":"https://in-toto.io/Statement/v1","subject_artifact_id":"beta-container","subject_sha256":"4444444444444444444444444444444444444444444444444444444444444444"},{"attestation_id":"beta-model-provenance","build_type":"https://github.com/actions/runner/build/v1","builder_id":"https://github.com/actions/runner","predicate_type":"https://slsa.dev/provenance/v1","source_sha256":"cccccccccccccccccccccccccccccccccccccccccccccccccccccccccccccccc","statement_sha256":"9999999999999999999999999999999999999999999999999999999999999999","statement_type":"https://in-toto.io/Statement/v1","subject_artifact_id":"beta-model","subject_sha256":"5555555555555555555555555555555555555555555555555555555555555555"},{"attestation_id":"beta-policy-provenance","build_type":"https://github.com/actions/runner/build/v1","builder_id":"https://github.com/actions/runner","predicate_type":"https://slsa.dev/provenance/v1","source_sha256":"dddddddddddddddddddddddddddddddddddddddddddddddddddddddddddddddd","statement_sha256":"aaaaaaaaaaaaaaaaaaaaaaaaaaaaaaaaaaaaaaaaaaaaaaaaaaaaaaaaaaaaaaaa","statement_type":"https://in-toto.io/Statement/v1","subject_artifact_id":"beta-policy","subject_sha256":"6666666666666666666666666666666666666666666666666666666666666666"}],"node_ids":["identity-policy-gateway"],"spiffe_id":"spiffe://example.com/agents/beta","workload_principal_id":"workload-be